{"$schema":"../schemas/capsule.schema.json","schemaVersion":"1.1.0","status":"characterization","identity":{"id":"pehlichi","displayName":"Pehlichi","role":"coordinator"},"personalityRef":"personality/pehlichi.yaml","skills":["skills/coordinator/SKILL.md"],"capabilityPacks":{"requested":[],"inactive":["work-orders@1.0.0","model-reports@0.1.0","onboarding@0.1.0","occasio@1.0.0"]},"routingPreferences":[{"purpose":"repair","targetAgentId":"ptah"},{"purpose":"creative","targetAgentId":"luna"}],"modelDefaults":{"providerRef":"mimo","model":"mimo-v2.5"},"memoryNamespace":"pehlichi","branding":{"themeRef":"tui/skin.yaml","icon":"🐿","welcomeRef":"personality/pehlichi.yaml"},"completion":{"criteriaRefs":["skills/coordinator/SKILL.md"],"reportFormatRefs":["skills/coordinator/SKILL.md"]}}
